{
  "metadata": {
    "title": "Using Agent Skills to Create Intelligent Textbooks",
    "description": "A professional-development course on building intelligent, interactive textbooks with a portable, token-efficient library of Agent Skills, Python automation, and AI-generated interactive media.",
    "creator": "Dan McCreary",
    "date": "2026-08-22",
    "version": "2.0",
    "format": "Learning Graph JSON v1.0",
    "schema": "https://raw.githubusercontent.com/dmccreary/learning-graphs/refs/heads/main/src/schema/learning-graph-schema.json",
    "license": "CC BY-NC-SA 4.0 DEED"
  },
  "groups": {
    "FOUND": {
      "classifierName": "Foundations of AI and Intelligent Books",
      "color": "SteelBlue",
      "font": {
        "color": "white"
      }
    },
    "SKARCH": {
      "classifierName": "Agent Skill Architecture",
      "color": "DarkSlateBlue",
      "font": {
        "color": "white"
      }
    },
    "SKDEV": {
      "classifierName": "Skill Development and Portability",
      "color": "DarkGreen",
      "font": {
        "color": "white"
      }
    },
    "PYTOOL": {
      "classifierName": "Python Tooling and Automation",
      "color": "LimeGreen",
      "font": {
        "color": "black"
      }
    },
    "TOKEN": {
      "classifierName": "Token Optimization and Measurement",
      "color": "Gold",
      "font": {
        "color": "black"
      }
    },
    "CDESIGN": {
      "classifierName": "Course Design and Pedagogy",
      "color": "DarkGoldenrod",
      "font": {
        "color": "white"
      }
    },
    "LGRAPH": {
      "classifierName": "Learning Graphs",
      "color": "DeepPink",
      "font": {
        "color": "white"
      }
    },
    "CONTENT": {
      "classifierName": "Chapter and Content Generation",
      "color": "Teal",
      "font": {
        "color": "white"
      }
    },
    "SUPPORT": {
      "classifierName": "Supporting Content",
      "color": "LightSkyBlue",
      "font": {
        "color": "black"
      }
    },
    "MSIM": {
      "classifierName": "Interactive Simulations",
      "color": "Crimson",
      "font": {
        "color": "white"
      }
    },
    "MEDIA": {
      "classifierName": "Images, Infographics, and Media",
      "color": "Orange",
      "font": {
        "color": "black"
      }
    },
    "DOMAIN": {
      "classifierName": "Domain-Specific Skill Extension",
      "color": "SaddleBrown",
      "font": {
        "color": "white"
      }
    },
    "PLATFORM": {
      "classifierName": "Platform, Tooling, and Deployment",
      "color": "MediumPurple",
      "font": {
        "color": "white"
      }
    },
    "PUBLISH": {
      "classifierName": "Publishing, Metrics, and Promotion",
      "color": "OliveDrab",
      "font": {
        "color": "white"
      }
    }
  },
  "nodes": [
    {
      "id": 1,
      "label": "Artificial Intelligence",
      "group": "FOUND",
      "shape": "box",
      "cis": 103499
    },
    {
      "id": 2,
      "label": "Large Language Model",
      "group": "FOUND",
      "cis": 83151
    },
    {
      "id": 3,
      "label": "Token",
      "group": "FOUND",
      "cis": 511
    },
    {
      "id": 4,
      "label": "Tokenization",
      "group": "FOUND",
      "cis": 1
    },
    {
      "id": 5,
      "label": "Context Window",
      "group": "FOUND",
      "cis": 151
    },
    {
      "id": 6,
      "label": "Prompt",
      "group": "FOUND",
      "cis": 37216
    },
    {
      "id": 7,
      "label": "Prompt Engineering",
      "group": "FOUND",
      "cis": 27291
    },
    {
      "id": 8,
      "label": "System Prompt",
      "group": "FOUND",
      "cis": 9923
    },
    {
      "id": 9,
      "label": "Nondeterminism in LLM Output",
      "group": "FOUND",
      "cis": 218
    },
    {
      "id": 10,
      "label": "Hallucination",
      "group": "FOUND",
      "cis": 152
    },
    {
      "id": 11,
      "label": "Grounding and Verification",
      "group": "FOUND",
      "cis": 65
    },
    {
      "id": 12,
      "label": "Python",
      "group": "PYTOOL",
      "shape": "box",
      "cis": 350
    },
    {
      "id": 13,
      "label": "Markdown Formatting",
      "group": "PLATFORM",
      "shape": "box",
      "cis": 23396
    },
    {
      "id": 14,
      "label": "Terminal Commands",
      "group": "PLATFORM",
      "shape": "box",
      "cis": 836
    },
    {
      "id": 15,
      "label": "Directory Navigation",
      "group": "PLATFORM",
      "cis": 599
    },
    {
      "id": 16,
      "label": "Shell Scripting",
      "group": "PLATFORM",
      "cis": 95
    },
    {
      "id": 17,
      "label": "Git",
      "group": "PLATFORM",
      "shape": "box",
      "cis": 64
    },
    {
      "id": 18,
      "label": "Git Repository Structure",
      "group": "PLATFORM",
      "cis": 29
    },
    {
      "id": 19,
      "label": "Version Control Basics",
      "group": "PLATFORM",
      "cis": 9
    },
    {
      "id": 20,
      "label": "GitHub Integration",
      "group": "PLATFORM",
      "cis": 17
    },
    {
      "id": 21,
      "label": "Visual Studio Code",
      "group": "PLATFORM",
      "shape": "box",
      "cis": 3
    },
    {
      "id": 22,
      "label": "VS Code Terminal",
      "group": "PLATFORM",
      "cis": 1
    },
    {
      "id": 23,
      "label": "AI Coding Agent",
      "group": "FOUND",
      "cis": 17311
    },
    {
      "id": 24,
      "label": "Tool Use by Agents",
      "group": "FOUND",
      "cis": 9897
    },
    {
      "id": 25,
      "label": "Agentic Workflow",
      "group": "FOUND",
      "cis": 7390
    },
    {
      "id": 26,
      "label": "Human in the Loop",
      "group": "FOUND",
      "cis": 42
    },
    {
      "id": 27,
      "label": "Claude Code Interface",
      "group": "FOUND",
      "cis": 18
    },
    {
      "id": 28,
      "label": "IDE Agent Integration",
      "group": "PLATFORM",
      "cis": 1
    },
    {
      "id": 29,
      "label": "Chat Versus Agent Interfaces",
      "group": "FOUND",
      "cis": 1
    },
    {
      "id": 30,
      "label": "Iterative Refinement",
      "group": "FOUND",
      "cis": 41
    },
    {
      "id": 31,
      "label": "Intelligent Textbook",
      "group": "FOUND",
      "cis": 20218
    },
    {
      "id": 32,
      "label": "Level 1 Static Content",
      "group": "FOUND",
      "cis": 415
    },
    {
      "id": 33,
      "label": "Level 2 Interactive Content",
      "group": "FOUND",
      "cis": 413
    },
    {
      "id": 34,
      "label": "Level 3 Adaptive Content",
      "group": "FOUND",
      "cis": 410
    },
    {
      "id": 35,
      "label": "Level 4 Chatbot Integration",
      "group": "FOUND",
      "cis": 4
    },
    {
      "id": 36,
      "label": "Level 5 Autonomous AI",
      "group": "FOUND",
      "cis": 2
    },
    {
      "id": 37,
      "label": "Five Levels of Intelligence",
      "group": "FOUND",
      "cis": 1
    },
    {
      "id": 38,
      "label": "Experience API",
      "group": "FOUND",
      "cis": 2
    },
    {
      "id": 39,
      "label": "Learning Record Store",
      "group": "FOUND",
      "cis": 1
    },
    {
      "id": 40,
      "label": "Open Educational Resources",
      "group": "FOUND",
      "cis": 13
    },
    {
      "id": 41,
      "label": "Creative Commons Licensing",
      "group": "FOUND",
      "cis": 12
    },
    {
      "id": 42,
      "label": "Textbook Generation Pipeline",
      "group": "FOUND",
      "cis": 4864
    },
    {
      "id": 43,
      "label": "Quality Gate",
      "group": "FOUND",
      "cis": 40
    },
    {
      "id": 44,
      "label": "MkDocs",
      "group": "PLATFORM",
      "cis": 85
    },
    {
      "id": 45,
      "label": "MkDocs Material Theme",
      "group": "PLATFORM",
      "cis": 36
    },
    {
      "id": 46,
      "label": "mkdocs.yml Configuration",
      "group": "PLATFORM",
      "cis": 17
    },
    {
      "id": 47,
      "label": "Navigation Structure",
      "group": "PLATFORM",
      "cis": 5
    },
    {
      "id": 48,
      "label": "Blank Line Before Lists",
      "group": "PLATFORM",
      "cis": 1
    },
    {
      "id": 49,
      "label": "Agent Skill",
      "group": "SKARCH",
      "cis": 2443
    },
    {
      "id": 50,
      "label": "Agent Skills Open Standard",
      "group": "SKARCH",
      "cis": 17
    },
    {
      "id": 51,
      "label": "SKILL.md File",
      "group": "SKARCH",
      "cis": 1105
    },
    {
      "id": 52,
      "label": "YAML Frontmatter",
      "group": "SKARCH",
      "cis": 559
    },
    {
      "id": 53,
      "label": "Skill Name Field",
      "group": "SKARCH",
      "cis": 3
    },
    {
      "id": 54,
      "label": "Skill Description Field",
      "group": "SKARCH",
      "cis": 541
    },
    {
      "id": 55,
      "label": "Skill License Field",
      "group": "SKARCH",
      "cis": 1
    },
    {
      "id": 56,
      "label": "Compatibility Field",
      "group": "SKARCH",
      "cis": 1
    },
    {
      "id": 57,
      "label": "Skill Metadata Field",
      "group": "SKARCH",
      "cis": 1
    },
    {
      "id": 58,
      "label": "Allowed Tools Field",
      "group": "SKARCH",
      "cis": 6
    },
    {
      "id": 59,
      "label": "Vendor Extension Fields",
      "group": "SKARCH",
      "cis": 1
    },
    {
      "id": 60,
      "label": "Frontmatter Contract",
      "group": "SKARCH",
      "cis": 1
    },
    {
      "id": 61,
      "label": "Skill Directory Structure",
      "group": "SKARCH",
      "cis": 308
    },
    {
      "id": 62,
      "label": "References Directory",
      "group": "SKARCH",
      "cis": 236
    },
    {
      "id": 63,
      "label": "Scripts Directory",
      "group": "SKARCH",
      "cis": 47
    },
    {
      "id": 64,
      "label": "Assets Directory",
      "group": "SKARCH",
      "cis": 3
    },
    {
      "id": 65,
      "label": "Progressive Disclosure",
      "group": "SKARCH",
      "cis": 227
    },
    {